Symbol,Name,Last Sale,Net Change,% Change,Market Cap,Country,IPO Year,Volume,Sector,Industry
ATCOL,Atlas Corp. 7.125% Notes due 2027,$23.60,-0.20,-0.84%,0.00,United Kingdom,,14736,Basic Materials,Precious Metals
ATLX,Atlas Lithium Corporation Common Stock,$9.68,-0.03,-0.309%,56993556.00,United States,,110414,Basic Materials,Precious Metals
AU,AngloGold Ashanti Limited Common Stock,$22.61,0.32,1.436%,9459730726.00,South Africa,,2507375,Basic Materials,Precious Metals
AUMN,Golden Minerals Company Common Stock,$0.31,-0.0039,-1.242%,51918178.00,United States,,397194,Basic Materials,Precious Metals
BHP,BHP Group Limited American Depositary Shares (Each representing two Ordinary Shares),$69.46,0.58,0.842%,175777981561.00,Australia,,4344890,Basic Materials,Metal Mining
BVN,Buenaventura Mining Company Inc.,$8.32,0.14,1.711%,2113170733.00,Peru,1996,708184,Basic Materials,Precious Metals
CDE,Coeur Mining Inc. Common Stock,$4.17,0.14,3.474%,1233093032.00,United States,,5313369,Basic Materials,Precious Metals
CHNR,China Natural Resources Inc. Common Stock,$0.4409,-0.0031,-0.698%,18054009.00,Hong Kong,,10488,Basic Materials,Other Metals and Minerals
CLW,Clearwater Paper Corporation Common Stock,$34.60,-1.03,-2.891%,579960667.00,United States,,121198,Basic Materials,Paper
CMCL,Caledonia Mining Corporation Plc Common Shares,$14.49,0.13,0.905%,250435191.00,Canada,,33276,Basic Materials,Precious Metals
CMP,Compass Minerals Intl Inc Common Stock,$45.14,0.41,0.917%,1851803769.00,United States,2003,347038,Basic Materials,Other Metals and Minerals
CTGO,Contango ORE Inc. Common Stock,$27.75,0.00,0.00%,195861998.00,,2021,347,Basic Materials,Precious Metals
DC,Dakota Gold Corp. Common Stock,$3.70,0.05,1.37%,270759529.00,,2022,127789,Basic Materials,Precious Metals
DRD,DRDGOLD Limited American Depositary Shares,$8.53,0.14,1.669%,731853903.00,South Africa,,117015,Basic Materials,Precious Metals
FCX,Freeport-McMoRan Inc. Common Stock,$45.41,1.27,2.877%,64905747743.00,United States,,12359017,Basic Materials,Metal Mining
GATO,Gatos Silver Inc. Common Stock,$5.25,0.28,5.634%,362956094.00,United States,2020,351697,Basic Materials,Precious Metals
GFI,Gold Fields Limited American Depositary Shares,$12.31,0.08,0.654%,10971263902.00,South Africa,,3148698,Basic Materials,Precious Metals
GLG,TD Holdings Inc. Common Stock,$1.15,-0.04,-3.361%,64054294.00,China,2013,556426,Basic Materials,Other Metals and Minerals
GLT,Glatfelter Corporation Common Stock,$3.31,0.08,2.477%,148276432.00,United States,2000,344844,Basic Materials,Paper
GORO,Gold Resource Corporation Common Stock,$1.68,0.04,2.439%,148508823.00,United States,,355757,Basic Materials,Precious Metals
GPK,Graphic Packaging Holding Company,$22.56,0.41,1.851%,6928583840.00,United States,,2661457,Basic Materials,Paper
GSM,Ferroglobe PLC Ordinary Shares,$4.79,0.14,3.011%,897231473.00,United Kingdom,,1095677,Basic Materials,Other Metals and Minerals
HL,Hecla Mining Company Common Stock,$6.26,0.08,1.294%,3795254069.00,United States,,8095509,Basic Materials,Precious Metals
HMY,Harmony Gold Mining Company Limited,$3.84,0.06,1.587%,2373214429.00,South Africa,,2643273,Basic Materials,Precious Metals
HYMC,Hycroft Mining Holding Corporation Class A Common Stock,$0.6336,0.0073,1.166%,31781403.00,United States,2018,1703567,Basic Materials,Precious Metals
HYMCL,Hycroft Mining Holding Corporation Warrants,$0.0815,0.0003,0.369%,0.00,United States,,2013,Basic Materials,Precious Metals
HYMCW,Hycroft Mining Holding Corporation  Warrant,$0.07,-0.0005,-0.709%,0.00,United States,2018,225177,Basic Materials,Precious Metals
IDR,Idaho Strategic Resources Inc. Common Stock,$5.50,-0.14,-2.482%,66539385.00,,2022,11800,Basic Materials,Precious Metals
IE,Ivanhoe Electric Inc. Common Stock,$13.61,-0.08,-0.584%,1264204564.00,,2022,248265,Basic Materials,Metal Mining
ITP,IT Tech Packaging Inc. Common Stock,$0.59,-0.0617,-9.468%,6735393.00,China,,68714,Basic Materials,Paper
MATV,Mativ Holdings Inc. Common Stock,$25.45,-0.12,-0.469%,1398305229.00,United States,,396820,Basic Materials,Paper
MERC,Mercer International Inc. Common Stock,$12.43,0.10,0.811%,822458184.00,Canada,,223629,Basic Materials,Paper
MP,MP Materials Corp. Common Stock,$30.21,1.53,5.335%,5363574846.00,,2020,1368712,Basic Materials,Precious Metals
MSB,Mesabi Trust Common Stock,$20.41,0.125,0.616%,267779404.00,United States,,48711,Basic Materials,Metal Mining
MUX,McEwen Mining Inc. Common Stock,$6.95,0.25,3.731%,329621556.00,Canada,,266869,Basic Materials,Other Metals and Minerals
NEM,Newmont Corporation,$53.34,0.87,1.658%,42338023912.00,United States,,4857975,Basic Materials,Precious Metals
NEXA,Nexa Resources S.A. Common Shares,$7.26,-0.10,-1.359%,961504316.00,,2017,68127,Basic Materials,Metal Mining
PKG,Packaging Corporation of America Common Stock,$132.48,2.71,2.088%,12258967910.00,United States,2000,491774,Basic Materials,Paper
PLL,Piedmont Lithium Inc. Common Stock,$62.56,3.62,6.142%,1126719864.00,United States,,468354,Basic Materials,Other Metals and Minerals
PZG,Paramount Gold Nevada Corp. Common Stock,$0.3914,-0.0037,-0.936%,18369333.00,United States,2015,85331,Basic Materials,Precious Metals
RFP,Resolute Forest Products Inc. Common Stock,$21.36,0.09,0.423%,1640700283.00,Canada,,342705,Basic Materials,Paper
RIO,Rio Tinto Plc Common Stock,$78.38,1.06,1.371%,127042593346.00,Australia,2002,3670428,Basic Materials,Metal Mining
SBSW,D/B/A Sibanye-Stillwater Limited ADS,$11.61,0.19,1.664%,8214766376.00,,,1872239,Basic Materials,Precious Metals
SCCO,Southern Copper Corporation Common Stock,$75.05,-1.11,-1.457%,58021040098.00,United States,,1632667,Basic Materials,Metal Mining
STKL,SunOpta Inc. Common Stock,$8.43,0.30,3.69%,909315151.00,Canada,,779668,Basic Materials,Precious Metals
SUZ,Suzano S.A. American Depositary Shares (each representing One Ordinary Share),$9.11,-0.40,-4.206%,11928196857.00,,2018,2342331,Basic Materials,Paper
UEC,Uranium Energy Corp. Common Stock,$3.75,0.10,2.74%,1386761408.00,Canada,,7861986,Basic Materials,Other Metals and Minerals
UFPI,UFP Industries Inc. Common Stock,$86.49,2.24,2.659%,5331028586.00,United States,1993,194831,Basic Materials,Forest Products
USAU,U.S. Gold Corp. Common Stock,$5.13,-0.01,-0.195%,42905591.00,United States,,16232,Basic Materials,Precious Metals
VALE,VALE S.A.  American Depositary Shares Each Representing one common share,$18.12,0.05,0.277%,84002751660.00,Brazil,,20681314,Basic Materials,Metal Mining
VGFC,The Very Good Food Company Inc. Common Shares,$0.0515,-0.001,-1.905%,6814134.00,Canada,,10625173,Basic Materials,Other Metals and Minerals
WWR,Westwater Resources Inc. Common Stock,$1.02,-0.025,-2.392%,49028016.00,United States,,152839,Basic Materials,Other Metals and Minerals
XPL,Solitario Zinc Corp. Common Stock,$0.6561,0.0166,2.596%,42494858.00,United States,,24964,Basic Materials,Precious Metals
